"No.","Time","Source","Destination","Protocol","Length","Info"
"1","0.000000","100.86.104.173","204.79.197.200","TLSv1.2","221","Application Data"
"2","0.000132","100.86.104.173","13.107.21.200","TCP","66","51940  >  443 [SYN] Seq=0 Win=64240 Len=0 MSS=1460 WS=256 SACK_PERM"
"3","0.011931","204.79.197.200","100.86.104.173","TCP","56","443  >  51913 [ACK] Seq=1 Ack=168 Win=16383 Len=0"
"4","0.012804","13.107.21.200","100.86.104.173","TCP","66","443  >  51940 [SYN, ACK] Seq=0 Ack=1 Win=65535 Len=0 MSS=1440 WS=256 SACK_PERM"
"5","0.012902","100.86.104.173","13.107.21.200","TCP","54","51940  >  443 [ACK] Seq=1 Ack=1 Win=132352 Len=0"
"6","0.013764","100.86.104.173","13.107.21.200","TLSv1.2","718","Client Hello (SNI=tse1.mm.bing.net)"
"7","0.015576","204.79.197.200","100.86.104.173","TCP","1514","443  >  51913 [ACK] Seq=1 Ack=168 Win=16383 Len=1460 [TCP segment of a reassembled PDU]"
"8","0.017261","204.79.197.200","100.86.104.173","TCP","1514","443  >  51913 [ACK] Seq=1461 Ack=168 Win=16383 Len=1460 [TCP segment of a reassembled PDU]"
"9","0.017261","204.79.197.200","100.86.104.173","TCP","1514","443  >  51913 [ACK] Seq=2921 Ack=168 Win=16383 Len=1460 [TCP segment of a reassembled PDU]"
"10","0.017261","204.79.197.200","100.86.104.173","TCP","1514","443  >  51913 [ACK] Seq=4381 Ack=168 Win=16383 Len=1460 [TCP segment of a reassembled PDU]"
"11","0.017261","204.79.197.200","100.86.104.173","TCP","1514","443  >  51913 [ACK] Seq=5841 Ack=168 Win=16383 Len=1460 [TCP segment of a reassembled PDU]"
"12","0.017261","204.79.197.200","100.86.104.173","TCP","1514","443  >  51913 [ACK] Seq=7301 Ack=168 Win=16383 Len=1460 [TCP segment of a reassembled PDU]"
"13","0.017261","204.79.197.200","100.86.104.173","TCP","1514","443  >  51913 [ACK] Seq=8761 Ack=168 Win=16383 Len=1460 [TCP segment of a reassembled PDU]"
"14","0.017345","100.86.104.173","204.79.197.200","TCP","54","51913  >  443 [ACK] Seq=168 Ack=2921 Win=2092 Len=0"
"15","0.017387","100.86.104.173","204.79.197.200","TCP","54","51913  >  443 [ACK] Seq=168 Ack=5841 Win=2092 Len=0"
"16","0.017421","100.86.104.173","204.79.197.200","TCP","54","51913  >  443 [ACK] Seq=168 Ack=8761 Win=2092 Len=0"
"17","0.017523","204.79.197.200","100.86.104.173","TLSv1.2","388","Application Data"
"18","0.017523","204.79.197.200","100.86.104.173","TLSv1.2","92","Application Data"
"19","0.017556","100.86.104.173","204.79.197.200","TCP","54","51913  >  443 [ACK] Seq=168 Ack=10555 Win=2092 Len=0"
"20","0.023914","13.107.21.200","100.86.104.173","TCP","56","443  >  51940 [ACK] Seq=1 Ack=665 Win=4193792 Len=0"
"21","0.025642","13.107.21.200","100.86.104.173","TCP","1514","443  >  51940 [ACK] Seq=1 Ack=665 Win=4193792 Len=1460 [TCP segment of a reassembled PDU]"
"22","0.026647","13.107.21.200","100.86.104.173","TCP","1514","443  >  51940 [ACK] Seq=1461 Ack=665 Win=4193792 Len=1460 [TCP segment of a reassembled PDU]"
"23","0.026647","13.107.21.200","100.86.104.173","TCP","1514","443  >  51940 [ACK] Seq=2921 Ack=665 Win=4193792 Len=1460 [TCP segment of a reassembled PDU]"
"24","0.026738","100.86.104.173","13.107.21.200","TCP","54","51940  >  443 [ACK] Seq=665 Ack=2921 Win=132352 Len=0"
"25","0.030112","13.107.21.200","100.86.104.173","TCP","1514","443  >  51940 [ACK] Seq=4381 Ack=665 Win=4193792 Len=1460 [TCP segment of a reassembled PDU]"
"26","0.030112","13.107.21.200","100.86.104.173","TLSv1.2","1334","Server Hello, Certificate, Certificate Status, Server Key Exchange, Server Hello Done"
"27","0.030209","100.86.104.173","13.107.21.200","TCP","54","51940  >  443 [ACK] Seq=665 Ack=5841 Win=132352 Len=0"
"28","0.034933","100.86.104.173","13.107.21.200","TLSv1.2","248","Client Key Exchange, Change Cipher Spec, Encrypted Handshake Message"
"29","0.047004","13.107.21.200","100.86.104.173","TCP","56","443  >  51940 [ACK] Seq=7121 Ack=859 Win=4193536 Len=0"
"30","0.050167","13.107.21.200","100.86.104.173","TLSv1.2","396","New Session Ticket, Change Cipher Spec, Encrypted Handshake Message"
"31","0.050490","13.107.21.200","100.86.104.173","TLSv1.2","123","Application Data"
"32","0.050523","100.86.104.173","13.107.21.200","TCP","54","51940  >  443 [ACK] Seq=859 Ack=7532 Win=132352 Len=0"
"33","0.051155","100.86.104.173","13.107.21.200","TLSv1.2","248","Application Data"
"34","0.051834","100.86.104.173","13.107.21.200","TCP","54","[TCP Previous segment not captured] 51940  >  443 [FIN, ACK] Seq=1084 Ack=7532 Win=132352 Len=0"
"35","0.051847","100.86.104.173","13.107.21.200","TCP","85","[TCP Out-Of-Order] 51940  >  443 [PSH, ACK] Seq=1053 Ack=7532 Win=132352 Len=31"
"36","0.060780","100.86.104.173","204.79.197.200","TCP","54","51913  >  443 [ACK] Seq=168 Ack=10593 Win=2092 Len=0"
"37","0.062996","13.107.21.200","100.86.104.173","TLSv1.2","92","Application Data"
"38","0.063065","100.86.104.173","13.107.21.200","TCP","54","51940  >  443 [RST, ACK] Seq=1085 Ack=7570 Win=0 Len=0"
"39","0.063494","13.107.21.200","100.86.104.173","TCP","56","[TCP Dup ACK 37#1] 443  >  51940 [ACK] Seq=7570 Ack=1053 Win=4193280 Len=0"
"40","0.063571","13.107.21.200","100.86.104.173","TCP","56","443  >  51940 [ACK] Seq=7570 Ack=1085 Win=4193280 Len=0"
"41","0.063571","13.107.21.200","100.86.104.173","TCP","56","443  >  51940 [FIN, ACK] Seq=7570 Ack=1085 Win=4193280 Len=0"
"42","1.151853","100.86.104.173","204.79.197.200","TLSv1.2","321","Application Data"
"43","1.165229","204.79.197.200","100.86.104.173","TCP","56","443  >  51913 [ACK] Seq=10593 Ack=435 Win=16382 Len=0"
"44","1.196490","204.79.197.200","100.86.104.173","TCP","1514","443  >  51913 [ACK] Seq=10593 Ack=435 Win=16382 Len=1460 [TCP segment of a reassembled PDU]"
"45","1.197855","204.79.197.200","100.86.104.173","TLSv1.2","115","Application Data"
"46","1.197855","204.79.197.200","100.86.104.173","TCP","1514","443  >  51913 [ACK] Seq=12114 Ack=435 Win=16382 Len=1460 [TCP segment of a reassembled PDU]"
"47","1.197855","204.79.197.200","100.86.104.173","TLSv1.2","314","Application Data"
"48","1.197855","204.79.197.200","100.86.104.173","TCP","1514","443  >  51913 [ACK] Seq=13834 Ack=435 Win=16382 Len=1460 [TCP segment of a reassembled PDU]"
"49","1.197855","204.79.197.200","100.86.104.173","TCP","1514","443  >  51913 [ACK] Seq=15294 Ack=435 Win=16382 Len=1460 [TCP segment of a reassembled PDU]"
"50","1.197855","204.79.197.200","100.86.104.173","TLSv1.2","1268","Application Data"
"51","1.197855","204.79.197.200","100.86.104.173","TCP","1514","443  >  51913 [ACK] Seq=17968 Ack=435 Win=16382 Len=1460 [TCP segment of a reassembled PDU]"
"52","1.197855","204.79.197.200","100.86.104.173","TCP","1514","443  >  51913 [ACK] Seq=19428 Ack=435 Win=16382 Len=1460 [TCP segment of a reassembled PDU]"
"53","1.198084","100.86.104.173","204.79.197.200","TCP","54","51913  >  443 [ACK] Seq=435 Ack=12114 Win=2092 Len=0"
"54","1.198288","100.86.104.173","204.79.197.200","TCP","54","51913  >  443 [ACK] Seq=435 Ack=13834 Win=2092 Len=0"
"55","1.198351","100.86.104.173","204.79.197.200","TCP","54","51913  >  443 [ACK] Seq=435 Ack=16754 Win=2092 Len=0"
"56","1.198401","100.86.104.173","204.79.197.200","TCP","54","51913  >  443 [ACK] Seq=435 Ack=19428 Win=2092 Len=0"
"57","1.200536","204.79.197.200","100.86.104.173","TLSv1.2","1268","Application Data"
"58","1.200536","204.79.197.200","100.86.104.173","TLSv1.2","761","Application Data"
"59","1.200667","100.86.104.173","204.79.197.200","TCP","54","51913  >  443 [ACK] Seq=435 Ack=22102 Win=2092 Len=0"
"60","1.219212","204.79.197.200","100.86.104.173","TCP","1514","443  >  51913 [ACK] Seq=22809 Ack=435 Win=16382 Len=1460 [TCP segment of a reassembled PDU]"
"61","1.219212","204.79.197.200","100.86.104.173","TCP","1514","443  >  51913 [ACK] Seq=24269 Ack=435 Win=16382 Len=1460 [TCP segment of a reassembled PDU]"
"62","1.219212","204.79.197.200","100.86.104.173","TLSv1.2","1212","Application Data"
"63","1.219395","100.86.104.173","204.79.197.200","TCP","54","51913  >  443 [ACK] Seq=435 Ack=24269 Win=2092 Len=0"
"64","1.219453","100.86.104.173","204.79.197.200","TCP","54","51913  >  443 [ACK] Seq=435 Ack=26887 Win=2092 Len=0"
"65","1.223680","204.79.197.200","100.86.104.173","TLSv1.2","142","Application Data"
"66","1.223680","204.79.197.200","100.86.104.173","TCP","1514","443  >  51913 [ACK] Seq=26975 Ack=435 Win=16382 Len=1460 [TCP segment of a reassembled PDU]"
"67","1.223884","100.86.104.173","204.79.197.200","TCP","54","51913  >  443 [ACK] Seq=435 Ack=28435 Win=2092 Len=0"
"68","1.227037","204.79.197.200","100.86.104.173","TCP","1514","443  >  51913 [ACK] Seq=28435 Ack=435 Win=16382 Len=1460 [TCP segment of a reassembled PDU]"
"69","1.227037","204.79.197.200","100.86.104.173","TCP","1514","[TCP Previous segment not captured] 443  >  51913 [ACK] Seq=31109 Ack=435 Win=16382 Len=1460 [TCP segment of a reassembled PDU]"
"70","1.227037","204.79.197.200","100.86.104.173","TCP","1514","443  >  51913 [ACK] Seq=32569 Ack=435 Win=16382 Len=1460 [TCP segment of a reassembled PDU]"
"71","1.227037","204.79.197.200","100.86.104.173","TCP","1514","[TCP Previous segment not captured] 443  >  51913 [ACK] Seq=35243 Ack=435 Win=16382 Len=1460 [TCP segment of a reassembled PDU]"
"72","1.227037","204.79.197.200","100.86.104.173","TCP","1514","443  >  51913 [ACK] Seq=36703 Ack=435 Win=16382 Len=1460 [TCP segment of a reassembled PDU]"
"73","1.227037","204.79.197.200","100.86.104.173","TLSv1.2","1268","Application Data"
"74","1.227037","204.79.197.200","100.86.104.173","TCP","1514","443  >  51913 [ACK] Seq=39377 Ack=435 Win=16382 Len=1460 [TCP segment of a reassembled PDU]"
"75","1.227037","204.79.197.200","100.86.104.173","TCP","1514","443  >  51913 [ACK] Seq=40837 Ack=435 Win=16382 Len=1460 [TCP segment of a reassembled PDU]"
"76","1.227037","204.79.197.200","100.86.104.173","TLSv1.2","1268","Application Data"
"77","1.227037","204.79.197.200","100.86.104.173","TCP","1514","443  >  51913 [ACK] Seq=43511 Ack=435 Win=16382 Len=1460 [TCP segment of a reassembled PDU]"
"78","1.227037","204.79.197.200","100.86.104.173","TCP","1514","443  >  51913 [ACK] Seq=44971 Ack=435 Win=16382 Len=1460 [TCP segment of a reassembled PDU]"
"79","1.227037","204.79.197.200","100.86.104.173","TCP","1514","[TCP Previous segment not captured] 443  >  51913 [ACK] Seq=47645 Ack=435 Win=16382 Len=1460 [TCP segment of a reassembled PDU]"
"80","1.227411","100.86.104.173","204.79.197.200","TCP","66","51913  >  443 [ACK] Seq=435 Ack=29895 Win=2092 Len=0 SLE=31109 SRE=32569"
"81","1.227489","100.86.104.173","204.79.197.200","TCP","66","[TCP Dup ACK 80#1] 51913  >  443 [ACK] Seq=435 Ack=29895 Win=2092 Len=0 SLE=31109 SRE=34029"
"82","1.227519","100.86.104.173","204.79.197.200","TCP","74","[TCP Dup ACK 80#2] 51913  >  443 [ACK] Seq=435 Ack=29895 Win=2092 Len=0 SLE=35243 SRE=36703 SLE=31109 SRE=34029"
"83","1.227548","100.86.104.173","204.79.197.200","TCP","74","[TCP Dup ACK 80#3] 51913  >  443 [ACK] Seq=435 Ack=29895 Win=2092 Len=0 SLE=35243 SRE=38163 SLE=31109 SRE=34029"
"84","1.227580","100.86.104.173","204.79.197.200","TCP","74","[TCP Dup ACK 80#4] 51913  >  443 [ACK] Seq=435 Ack=29895 Win=2092 Len=0 SLE=35243 SRE=39377 SLE=31109 SRE=34029"
"85","1.227612","100.86.104.173","204.79.197.200","TCP","74","[TCP Dup ACK 80#5] 51913  >  443 [ACK] Seq=435 Ack=29895 Win=2092 Len=0 SLE=35243 SRE=40837 SLE=31109 SRE=34029"
"86","1.227642","100.86.104.173","204.79.197.200","TCP","74","[TCP Dup ACK 80#6] 51913  >  443 [ACK] Seq=435 Ack=29895 Win=2092 Len=0 SLE=35243 SRE=42297 SLE=31109 SRE=34029"
"87","1.227670","100.86.104.173","204.79.197.200","TCP","74","[TCP Dup ACK 80#7] 51913  >  443 [ACK] Seq=435 Ack=29895 Win=2092 Len=0 SLE=35243 SRE=43511 SLE=31109 SRE=34029"
"88","1.227702","100.86.104.173","204.79.197.200","TCP","74","[TCP Dup ACK 80#8] 51913  >  443 [ACK] Seq=435 Ack=29895 Win=2092 Len=0 SLE=35243 SRE=44971 SLE=31109 SRE=34029"
"89","1.227763","100.86.104.173","204.79.197.200","TCP","74","[TCP Dup ACK 80#9] 51913  >  443 [ACK] Seq=435 Ack=29895 Win=2092 Len=0 SLE=35243 SRE=46431 SLE=31109 SRE=34029"
"90","1.227803","100.86.104.173","204.79.197.200","TCP","82","[TCP Dup ACK 80#10] 51913  >  443 [ACK] Seq=435 Ack=29895 Win=2092 Len=0 SLE=47645 SRE=49105 SLE=35243 SRE=46431 SLE=31109 SRE=34029"
"91","1.229617","204.79.197.200","100.86.104.173","TLSv1.2","469","Application Data"
"92","1.229617","204.79.197.200","100.86.104.173","TLSv1.2","92","Application Data"
"93","1.229757","100.86.104.173","204.79.197.200","TCP","82","[TCP Dup ACK 80#11] 51913  >  443 [ACK] Seq=435 Ack=29895 Win=2092 Len=0 SLE=47645 SRE=49520 SLE=35243 SRE=46431 SLE=31109 SRE=34029"
"94","1.229844","100.86.104.173","204.79.197.200","TCP","82","[TCP Dup ACK 80#12] 51913  >  443 [ACK] Seq=435 Ack=29895 Win=2092 Len=0 SLE=47645 SRE=49558 SLE=35243 SRE=46431 SLE=31109 SRE=34029"
"95","1.239710","204.79.197.200","100.86.104.173","TLSv1.2","1514","[TCP Fast Retransmission] , Application Data"
"96","1.239878","100.86.104.173","204.79.197.200","TCP","82","51913  >  443 [ACK] Seq=435 Ack=34029 Win=2092 Len=0 SLE=31109 SRE=31355 SLE=47645 SRE=49558 SLE=35243 SRE=46431"
"97","1.250065","204.79.197.200","100.86.104.173","TCP","1268","[TCP Retransmission] 443  >  51913 [PSH, ACK] Seq=34029 Ack=435 Win=16382 Len=1214"
"98","1.250221","100.86.104.173","204.79.197.200","TCP","66","51913  >  443 [ACK] Seq=435 Ack=46431 Win=2092 Len=0 SLE=47645 SRE=49558"
"99","1.254957","204.79.197.200","100.86.104.173","TCP","1268","[TCP Retransmission] 443  >  51913 [PSH, ACK] Seq=46431 Ack=435 Win=16382 Len=1214"
"100","1.255071","100.86.104.173","204.79.197.200","TCP","54","51913  >  443 [ACK] Seq=435 Ack=49558 Win=2092 Len=0"
"101","1.540621","100.86.104.173","204.79.197.200","TLSv1.2","773","Application Data"
"102","1.540995","100.86.104.173","204.79.197.200","TLSv1.2","647","Application Data"
"103","1.541396","100.86.104.173","204.79.197.200","TLSv1.2","247","Application Data"
"104","1.541720","100.86.104.173","204.79.197.200","TLSv1.2","240","Application Data"
"105","1.541917","100.86.104.173","204.79.197.200","TLSv1.2","211","Application Data"
"106","1.556360","204.79.197.200","100.86.104.173","TCP","56","443  >  51913 [ACK] Seq=49558 Ack=1154 Win=16379 Len=0"
"107","1.556360","204.79.197.200","100.86.104.173","TCP","56","443  >  51913 [ACK] Seq=49558 Ack=1747 Win=16385 Len=0"
"108","1.556684","204.79.197.200","100.86.104.173","TCP","56","443  >  51913 [ACK] Seq=49558 Ack=2283 Win=16382 Len=0"
"109","1.595317","204.79.197.200","100.86.104.173","TCP","1514","443  >  51913 [ACK] Seq=49558 Ack=2283 Win=16382 Len=1460 [TCP segment of a reassembled PDU]"
"110","1.596379","204.79.197.200","100.86.104.173","TCP","1514","443  >  51913 [ACK] Seq=51018 Ack=2283 Win=16382 Len=1460 [TCP segment of a reassembled PDU]"
"111","1.596379","204.79.197.200","100.86.104.173","TLSv1.2","525","Application Data"
"112","1.596577","100.86.104.173","204.79.197.200","TCP","54","51913  >  443 [ACK] Seq=2283 Ack=52478 Win=2092 Len=0"
"113","1.603101","204.79.197.200","100.86.104.173","TCP","1514","443  >  51913 [ACK] Seq=52949 Ack=2283 Win=16382 Len=1460 [TCP segment of a reassembled PDU]"
"114","1.603101","204.79.197.200","100.86.104.173","TCP","1514","443  >  51913 [ACK] Seq=54409 Ack=2283 Win=16382 Len=1460 [TCP segment of a reassembled PDU]"
"115","1.603101","204.79.197.200","100.86.104.173","TLSv1.2","1268","Application Data"
"116","1.603101","204.79.197.200","100.86.104.173","TCP","1514","443  >  51913 [ACK] Seq=57083 Ack=2283 Win=16382 Len=1460 [TCP segment of a reassembled PDU]"
"117","1.603101","204.79.197.200","100.86.104.173","TCP","1514","443  >  51913 [ACK] Seq=58543 Ack=2283 Win=16382 Len=1460 [TCP segment of a reassembled PDU]"
"118","1.603101","204.79.197.200","100.86.104.173","TLSv1.2","168","Application Data"
"119","1.603101","204.79.197.200","100.86.104.173","TLSv1.2","92","Application Data"
"120","1.603101","204.79.197.200","100.86.104.173","TCP","1514","443  >  51913 [ACK] Seq=60155 Ack=2283 Win=16382 Len=1460 [TCP segment of a reassembled PDU]"
"121","1.603101","204.79.197.200","100.86.104.173","TCP","1514","443  >  51913 [ACK] Seq=61615 Ack=2283 Win=16382 Len=1460 [TCP segment of a reassembled PDU]"
"122","1.603101","204.79.197.200","100.86.104.173","TLSv1.2","1053","Application Data"
"123","1.603101","204.79.197.200","100.86.104.173","TCP","1514","443  >  51913 [ACK] Seq=64074 Ack=2283 Win=16382 Len=1460 [TCP segment of a reassembled PDU]"
"124","1.603101","204.79.197.200","100.86.104.173","TCP","1514","443  >  51913 [ACK] Seq=65534 Ack=2283 Win=16382 Len=1460 [TCP segment of a reassembled PDU]"
"125","1.603101","204.79.197.200","100.86.104.173","TLSv1.2","1268","Application Data"
"126","1.603101","204.79.197.200","100.86.104.173","TCP","1514","443  >  51913 [ACK] Seq=68208 Ack=2283 Win=16382 Len=1460 [TCP segment of a reassembled PDU]"
"127","1.603101","204.79.197.200","100.86.104.173","TCP","1514","443  >  51913 [ACK] Seq=69668 Ack=2283 Win=16382 Len=1460 [TCP segment of a reassembled PDU]"
"128","1.603101","204.79.197.200","100.86.104.173","TLSv1.2","1268","Application Data"
"129","1.603101","204.79.197.200","100.86.104.173","TCP","1514","443  >  51913 [ACK] Seq=72342 Ack=2283 Win=16382 Len=1460 [TCP segment of a reassembled PDU]"
"130","1.603101","204.79.197.200","100.86.104.173","TCP","1514","443  >  51913 [ACK] Seq=73802 Ack=2283 Win=16382 Len=1460 [TCP segment of a reassembled PDU]"
"131","1.603101","204.79.197.200","100.86.104.173","TLSv1.2","1268","Application Data"
"132","1.603101","204.79.197.200","100.86.104.173","TLSv1.2","792","Application Data"
"133","1.603101","204.79.197.200","100.86.104.173","TLSv1.2","92","Application Data"
"134","1.603101","204.79.197.200","100.86.104.173","TLSv1.2","253","Application Data"
"135","1.603101","204.79.197.200","100.86.104.173","TLSv1.2","557","Application Data"
"136","1.603101","204.79.197.200","100.86.104.173","TLSv1.2","92","Application Data"
"137","1.603789","100.86.104.173","204.79.197.200","TCP","54","51913  >  443 [ACK] Seq=2283 Ack=54409 Win=2092 Len=0"
"138","1.603922","100.86.104.173","204.79.197.200","TCP","54","51913  >  443 [ACK] Seq=2283 Ack=57083 Win=2092 Len=0"
"139","1.603971","100.86.104.173","204.79.197.200","TCP","54","51913  >  443 [ACK] Seq=2283 Ack=60003 Win=2092 Len=0"
"140","1.604024","100.86.104.173","204.79.197.200","TCP","54","51913  >  443 [ACK] Seq=2283 Ack=60155 Win=2091 Len=0"
"141","1.604074","100.86.104.173","204.79.197.200","TCP","54","51913  >  443 [ACK] Seq=2283 Ack=63075 Win=2092 Len=0"
"142","1.604130","100.86.104.173","204.79.197.200","TCP","54","51913  >  443 [ACK] Seq=2283 Ack=65534 Win=2092 Len=0"
"143","1.604199","100.86.104.173","204.79.197.200","TCP","54","51913  >  443 [ACK] Seq=2283 Ack=68208 Win=2092 Len=0"
"144","1.604277","100.86.104.173","204.79.197.200","TCP","54","51913  >  443 [ACK] Seq=2283 Ack=71128 Win=2092 Len=0"
"145","1.604323","100.86.104.173","204.79.197.200","TCP","54","51913  >  443 [ACK] Seq=2283 Ack=73802 Win=2092 Len=0"
"146","1.604372","100.86.104.173","204.79.197.200","TCP","54","51913  >  443 [ACK] Seq=2283 Ack=76476 Win=2092 Len=0"
"147","1.604420","100.86.104.173","204.79.197.200","TCP","54","51913  >  443 [ACK] Seq=2283 Ack=77252 Win=2089 Len=0"
"148","1.604474","100.86.104.173","204.79.197.200","TCP","54","51913  >  443 [ACK] Seq=2283 Ack=77954 Win=2092 Len=0"
"149","1.611654","204.79.197.200","100.86.104.173","TLSv1.2","608","Application Data"
"150","1.611654","204.79.197.200","100.86.104.173","TLSv1.2","92","Application Data"
"151","1.611944","100.86.104.173","204.79.197.200","TCP","54","51913  >  443 [ACK] Seq=2283 Ack=78546 Win=2090 Len=0"
"152","1.613690","204.79.197.200","100.86.104.173","TCP","1514","443  >  51913 [ACK] Seq=78584 Ack=2283 Win=16382 Len=1460 [TCP segment of a reassembled PDU]"
"153","1.613690","204.79.197.200","100.86.104.173","TCP","1514","443  >  51913 [ACK] Seq=80044 Ack=2283 Win=16382 Len=1460 [TCP segment of a reassembled PDU]"
"154","1.613690","204.79.197.200","100.86.104.173","TLSv1.2","375","Application Data"
"155","1.613910","100.86.104.173","204.79.197.200","TCP","54","51913  >  443 [ACK] Seq=2283 Ack=80044 Win=2092 Len=0"
"156","1.614080","100.86.104.173","204.79.197.200","TCP","54","51913  >  443 [ACK] Seq=2283 Ack=81825 Win=2092 Len=0"
"157","1.615409","204.79.197.200","100.86.104.173","TLSv1.2","92","Application Data"
"158","1.661375","100.86.104.173","204.79.197.200","TCP","54","51913  >  443 [ACK] Seq=2283 Ack=81863 Win=2092 Len=0"
"159","1.749309","100.86.104.173","204.79.197.200","TLSv1.2","827","Application Data"
"160","1.749900","100.86.104.173","204.79.197.200","TLSv1.2","307","Application Data"
"161","1.750580","100.86.104.173","204.79.197.200","TLSv1.2","253","Application Data"
"162","1.762042","204.79.197.200","100.86.104.173","TCP","56","443  >  51913 [ACK] Seq=81863 Ack=3309 Win=16385 Len=0"
"163","1.762221","204.79.197.200","100.86.104.173","TCP","56","443  >  51913 [ACK] Seq=81863 Ack=3508 Win=16384 Len=0"
"164","1.765090","204.79.197.200","100.86.104.173","TCP","1514","443  >  51913 [ACK] Seq=81863 Ack=3508 Win=16384 Len=1460 [TCP segment of a reassembled PDU]"
"165","1.765512","204.79.197.200","100.86.104.173","TCP","1514","443  >  51913 [ACK] Seq=83323 Ack=3508 Win=16384 Len=1460 [TCP segment of a reassembled PDU]"
"166","1.765512","204.79.197.200","100.86.104.173","TCP","1514","443  >  51913 [ACK] Seq=84783 Ack=3508 Win=16384 Len=1460 [TCP segment of a reassembled PDU]"
"167","1.765645","100.86.104.173","204.79.197.200","TCP","54","51913  >  443 [ACK] Seq=3508 Ack=84783 Win=2092 Len=0"
"168","1.767148","204.79.197.200","100.86.104.173","TCP","1514","443  >  51913 [ACK] Seq=86243 Ack=3508 Win=16384 Len=1460 [TCP segment of a reassembled PDU]"
"169","1.767148","204.79.197.200","100.86.104.173","TLSv1.2","564","Application Data"
"170","1.767148","204.79.197.200","100.86.104.173","TLSv1.2","92","Application Data"
"171","1.767148","204.79.197.200","100.86.104.173","TCP","1514","443  >  51913 [ACK] Seq=88251 Ack=3508 Win=16384 Len=1460 [TCP segment of a reassembled PDU]"
"172","1.767148","204.79.197.200","100.86.104.173","TCP","1514","443  >  51913 [ACK] Seq=89711 Ack=3508 Win=16384 Len=1460 [TCP segment of a reassembled PDU]"
"173","1.767148","204.79.197.200","100.86.104.173","TCP","1514","443  >  51913 [ACK] Seq=91171 Ack=3508 Win=16384 Len=1460 [TCP segment of a reassembled PDU]"
"174","1.767148","204.79.197.200","100.86.104.173","TCP","1514","443  >  51913 [ACK] Seq=92631 Ack=3508 Win=16384 Len=1460 [TCP segment of a reassembled PDU]"
"175","1.767148","204.79.197.200","100.86.104.173","TLSv1.2","408","Application Data"
"176","1.767148","204.79.197.200","100.86.104.173","TLSv1.2","92","Application Data"
"177","1.767148","204.79.197.200","100.86.104.173","TCP","1514","443  >  51913 [ACK] Seq=94483 Ack=3508 Win=16384 Len=1460 [TCP segment of a reassembled PDU]"
"178","1.767148","204.79.197.200","100.86.104.173","TCP","1514","443  >  51913 [ACK] Seq=95943 Ack=3508 Win=16384 Len=1460 [TCP segment of a reassembled PDU]"
"179","1.767148","204.79.197.200","100.86.104.173","TLSv1.2","1034","Application Data"
"180","1.767519","100.86.104.173","204.79.197.200","TCP","54","51913  >  443 [ACK] Seq=3508 Ack=87703 Win=2092 Len=0"
"181","1.767644","100.86.104.173","204.79.197.200","TCP","54","51913  >  443 [ACK] Seq=3508 Ack=88251 Win=2090 Len=0"
"182","1.767708","100.86.104.173","204.79.197.200","TCP","54","51913  >  443 [ACK] Seq=3508 Ack=91171 Win=2092 Len=0"
"183","1.767763","100.86.104.173","204.79.197.200","TCP","54","51913  >  443 [ACK] Seq=3508 Ack=94091 Win=2092 Len=0"
"184","1.767808","100.86.104.173","204.79.197.200","TCP","54","51913  >  443 [ACK] Seq=3508 Ack=94483 Win=2090 Len=0"
"185","1.767809","204.79.197.200","100.86.104.173","TLSv1.2","92","Application Data"
"186","1.767876","100.86.104.173","204.79.197.200","TCP","54","51913  >  443 [ACK] Seq=3508 Ack=97403 Win=2092 Len=0"
"187","1.767939","100.86.104.173","204.79.197.200","TCP","54","51913  >  443 [ACK] Seq=3508 Ack=98421 Win=2088 Len=0"
"188","2.052611","100.86.104.173","204.79.197.200","TLSv1.2","400","Application Data"
"189","2.052683","100.86.104.173","204.79.197.200","TLSv1.2","96","Application Data"
"190","2.065021","204.79.197.200","100.86.104.173","TCP","56","443  >  51913 [ACK] Seq=98421 Ack=3896 Win=16382 Len=0"
"191","2.078783","100.86.104.173","204.79.197.200","TLSv1.2","322","Application Data"
"192","2.078906","100.86.104.173","204.79.197.200","TLSv1.2","140","Application Data"
"193","2.088513","204.79.197.200","100.86.104.173","TLSv1.2","1078","Application Data"
"194","2.088624","100.86.104.173","204.79.197.200","TCP","54","51913  >  443 [ACK] Seq=4250 Ack=99445 Win=2092 Len=0"
"195","2.088868","204.79.197.200","100.86.104.173","TLSv1.2","92","Application Data"
"196","2.088938","100.86.104.173","204.79.197.200","TCP","54","51913  >  443 [ACK] Seq=4250 Ack=99483 Win=2092 Len=0"
"197","2.089975","204.79.197.200","100.86.104.173","TCP","56","443  >  51913 [ACK] Seq=99483 Ack=4250 Win=16381 Len=0"
"198","2.098385","100.86.104.173","204.79.197.200","TLSv1.2","413","Application Data"
"199","2.108861","204.79.197.200","100.86.104.173","TCP","56","443  >  51913 [ACK] Seq=99483 Ack=4609 Win=16380 Len=0"
"200","2.131293","204.79.197.200","100.86.104.173","TCP","1514","443  >  51913 [ACK] Seq=99483 Ack=4609 Win=16380 Len=1460 [TCP segment of a reassembled PDU]"
"201","2.133187","204.79.197.200","100.86.104.173","TLSv1.2","563","Application Data"
"202","2.133187","204.79.197.200","100.86.104.173","TLSv1.2","92","Application Data"
"203","2.133242","100.86.104.173","204.79.197.200","TCP","54","51913  >  443 [ACK] Seq=4609 Ack=101452 Win=2092 Len=0"
"204","2.136634","204.79.197.200","100.86.104.173","TLSv1.2","404","Application Data"
"205","2.136784","100.86.104.173","204.79.197.200","TCP","54","51913  >  443 [ACK] Seq=4609 Ack=101840 Win=2090 Len=0"
"206","2.138520","204.79.197.200","100.86.104.173","TLSv1.2","92","Application Data"
"207","2.188930","100.86.104.173","204.79.197.200","TCP","54","51913  >  443 [ACK] Seq=4609 Ack=101878 Win=2090 Len=0"
"208","7.026242","100.86.104.173","204.79.197.200","TLSv1.2","647","Application Data"
"209","7.043898","204.79.197.200","100.86.104.173","TCP","56","443  >  51913 [ACK] Seq=101878 Ack=5202 Win=16385 Len=0"
"210","7.084444","204.79.197.200","100.86.104.173","TCP","1514","443  >  51913 [ACK] Seq=101878 Ack=5202 Win=16385 Len=1460 [TCP segment of a reassembled PDU]"
"211","7.087814","204.79.197.200","100.86.104.173","TLSv1.2","390","Application Data"
"212","7.087814","204.79.197.200","100.86.104.173","TCP","1514","443  >  51913 [ACK] Seq=103674 Ack=5202 Win=16385 Len=1460 [TCP segment of a reassembled PDU]"
"213","7.087814","204.79.197.200","100.86.104.173","TLSv1.2","242","Application Data"
"214","7.087814","204.79.197.200","100.86.104.173","TCP","1514","443  >  51913 [ACK] Seq=105322 Ack=5202 Win=16385 Len=1460 [TCP segment of a reassembled PDU]"
"215","7.087814","204.79.197.200","100.86.104.173","TCP","1514","443  >  51913 [ACK] Seq=106782 Ack=5202 Win=16385 Len=1460 [TCP segment of a reassembled PDU]"
"216","7.087814","204.79.197.200","100.86.104.173","TLSv1.2","1268","Application Data"
"217","7.087814","204.79.197.200","100.86.104.173","TCP","1514","443  >  51913 [ACK] Seq=109456 Ack=5202 Win=16385 Len=1460 [TCP segment of a reassembled PDU]"
"218","7.087814","204.79.197.200","100.86.104.173","TCP","1514","443  >  51913 [ACK] Seq=110916 Ack=5202 Win=16385 Len=1460 [TCP segment of a reassembled PDU]"
"219","7.087814","204.79.197.200","100.86.104.173","TLSv1.2","1268","Application Data"
"220","7.087814","204.79.197.200","100.86.104.173","TCP","1514","443  >  51913 [ACK] Seq=113590 Ack=5202 Win=16385 Len=1460 [TCP segment of a reassembled PDU]"
"221","7.087814","204.79.197.200","100.86.104.173","TCP","1514","443  >  51913 [ACK] Seq=115050 Ack=5202 Win=16385 Len=1460 [TCP segment of a reassembled PDU]"
"222","7.087814","204.79.197.200","100.86.104.173","TLSv1.2","1268","Application Data"
"223","7.087959","100.86.104.173","204.79.197.200","TCP","54","51913  >  443 [ACK] Seq=5202 Ack=103674 Win=2092 Len=0"
"224","7.088017","100.86.104.173","204.79.197.200","TCP","54","51913  >  443 [ACK] Seq=5202 Ack=105322 Win=2092 Len=0"
"225","7.088046","100.86.104.173","204.79.197.200","TCP","54","51913  >  443 [ACK] Seq=5202 Ack=108242 Win=2092 Len=0"
"226","7.088066","100.86.104.173","204.79.197.200","TCP","54","51913  >  443 [ACK] Seq=5202 Ack=110916 Win=2092 Len=0"
"227","7.088092","100.86.104.173","204.79.197.200","TCP","54","51913  >  443 [ACK] Seq=5202 Ack=113590 Win=2092 Len=0"
"228","7.088120","100.86.104.173","204.79.197.200","TCP","54","51913  >  443 [ACK] Seq=5202 Ack=116510 Win=2092 Len=0"
"229","7.088181","204.79.197.200","100.86.104.173","TCP","1514","443  >  51913 [ACK] Seq=117724 Ack=5202 Win=16385 Len=1460 [TCP segment of a reassembled PDU]"
"230","7.088181","204.79.197.200","100.86.104.173","TCP","1514","443  >  51913 [ACK] Seq=119184 Ack=5202 Win=16385 Len=1460 [TCP segment of a reassembled PDU]"
"231","7.088181","204.79.197.200","100.86.104.173","TLSv1.2","1268","Application Data"
"232","7.088181","204.79.197.200","100.86.104.173","TCP","1514","443  >  51913 [ACK] Seq=121858 Ack=5202 Win=16385 Len=1460 [TCP segment of a reassembled PDU]"
"233","7.088181","204.79.197.200","100.86.104.173","TCP","1514","443  >  51913 [ACK] Seq=123318 Ack=5202 Win=16385 Len=1460 [TCP segment of a reassembled PDU]"
"234","7.088181","204.79.197.200","100.86.104.173","TLSv1.2","720","Application Data"
"235","7.088259","100.86.104.173","204.79.197.200","TCP","54","51913  >  443 [ACK] Seq=5202 Ack=119184 Win=2092 Len=0"
"236","7.088293","100.86.104.173","204.79.197.200","TCP","54","51913  >  443 [ACK] Seq=5202 Ack=121858 Win=2092 Len=0"
"237","7.088317","100.86.104.173","204.79.197.200","TCP","54","51913  >  443 [ACK] Seq=5202 Ack=124778 Win=2092 Len=0"
"238","7.088951","204.79.197.200","100.86.104.173","TLSv1.2","92","Application Data"
"239","7.089014","100.86.104.173","204.79.197.200","TCP","54","51913  >  443 [ACK] Seq=5202 Ack=125482 Win=2089 Len=0"
"240","7.407531","100.86.104.173","204.79.197.200","TLSv1.2","342","Application Data"
"241","7.422586","204.79.197.200","100.86.104.173","TCP","56","443  >  51913 [ACK] Seq=125482 Ack=5490 Win=16383 Len=0"
"242","7.476723","204.79.197.200","100.86.104.173","TCP","1514","443  >  51913 [ACK] Seq=125482 Ack=5490 Win=16383 Len=1460 [TCP segment of a reassembled PDU]"
"243","7.478314","204.79.197.200","100.86.104.173","TLSv1.2","189","Application Data"
"244","7.478314","204.79.197.200","100.86.104.173","TLSv1.2","92","Application Data"
"245","7.478390","100.86.104.173","204.79.197.200","TCP","54","51913  >  443 [ACK] Seq=5490 Ack=127077 Win=2092 Len=0"
"246","7.523873","100.86.104.173","204.79.197.200","TCP","54","51913  >  443 [ACK] Seq=5490 Ack=127115 Win=2092 Len=0"
"247","7.590759","100.86.104.173","204.79.197.200","TLSv1.2","269","Application Data"
"248","7.602447","204.79.197.200","100.86.104.173","TCP","56","443  >  51913 [ACK] Seq=127115 Ack=5705 Win=16383 Len=0"
"249","7.637073","100.86.104.173","204.79.197.200","TLSv1.2","269","Application Data"
"250","7.648738","204.79.197.200","100.86.104.173","TCP","56","443  >  51913 [ACK] Seq=127115 Ack=5920 Win=16382 Len=0"
"251","7.659799","204.79.197.200","100.86.104.173","TLSv1.2","774","Application Data"
"252","7.660337","204.79.197.200","100.86.104.173","TLSv1.2","749","Application Data"
"253","7.660337","204.79.197.200","100.86.104.173","TLSv1.2","92","Application Data"
"254","7.660390","100.86.104.173","204.79.197.200","TCP","54","51913  >  443 [ACK] Seq=5920 Ack=128530 Win=2092 Len=0"
"255","7.706192","204.79.197.200","100.86.104.173","TCP","1514","443  >  51913 [ACK] Seq=128568 Ack=5920 Win=16382 Len=1460 [TCP segment of a reassembled PDU]"
"256","7.706272","100.86.104.173","204.79.197.200","TCP","54","51913  >  443 [ACK] Seq=5920 Ack=130028 Win=2092 Len=0"
"257","7.711283","204.79.197.200","100.86.104.173","TLSv1.2","117","Application Data"
"258","7.711283","204.79.197.200","100.86.104.173","TLSv1.2","92","Application Data"
"259","7.711459","100.86.104.173","204.79.197.200","TCP","54","51913  >  443 [ACK] Seq=5920 Ack=130129 Win=2092 Len=0"
"260","7.747458","100.86.104.173","204.79.197.200","TLSv1.2","270","Application Data"
"261","7.760228","204.79.197.200","100.86.104.173","TCP","56","443  >  51913 [ACK] Seq=130129 Ack=6136 Win=16381 Len=0"
"262","7.812261","204.79.197.200","100.86.104.173","TLSv1.2","1063","Application Data"
"263","7.813360","204.79.197.200","100.86.104.173","TLSv1.2","396","Application Data"
"264","7.813360","204.79.197.200","100.86.104.173","TLSv1.2","92","Application Data"
"265","7.813460","100.86.104.173","204.79.197.200","TCP","54","51913  >  443 [ACK] Seq=6136 Ack=131480 Win=2092 Len=0"
"266","7.834948","100.86.104.173","204.79.197.200","TLSv1.2","415","Application Data"
"267","7.845208","204.79.197.200","100.86.104.173","TCP","56","443  >  51913 [ACK] Seq=131518 Ack=6497 Win=16380 Len=0"
"268","7.899324","204.79.197.200","100.86.104.173","TCP","1514","443  >  51913 [ACK] Seq=131518 Ack=6497 Win=16380 Len=1460 [TCP segment of a reassembled PDU]"
"269","7.899324","204.79.197.200","100.86.104.173","TLSv1.2","606","Application Data"
"270","7.899324","204.79.197.200","100.86.104.173","TLSv1.2","1266","Application Data"
"271","7.899479","100.86.104.173","204.79.197.200","TCP","54","51913  >  443 [ACK] Seq=6497 Ack=133530 Win=2092 Len=0"
"272","7.946019","100.86.104.173","204.79.197.200","TCP","54","51913  >  443 [ACK] Seq=6497 Ack=134742 Win=2087 Len=0"
"273","8.256732","204.79.197.200","100.86.104.173","TLSv1.2","1268","[TCP Previous segment not captured] , Ignored Unknown Record"
"274","8.256732","204.79.197.200","100.86.104.173","TCP","1514","443  >  51913 [ACK] Seq=138876 Ack=6497 Win=16380 Len=1460 [TCP segment of a reassembled PDU]"
"275","8.256732","204.79.197.200","100.86.104.173","TCP","1514","443  >  51913 [ACK] Seq=140336 Ack=6497 Win=16380 Len=1460 [TCP segment of a reassembled PDU]"
"276","8.256732","204.79.197.200","100.86.104.173","TLSv1.2","1268","Application Data"
"277","8.256732","204.79.197.200","100.86.104.173","TCP","1514","443  >  51913 [ACK] Seq=143010 Ack=6497 Win=16380 Len=1460 [TCP segment of a reassembled PDU]"
"278","8.256732","204.79.197.200","100.86.104.173","TCP","1514","443  >  51913 [ACK] Seq=144470 Ack=6497 Win=16380 Len=1460 [TCP segment of a reassembled PDU]"
"279","8.256732","204.79.197.200","100.86.104.173","TLSv1.2","1268","Application Data"
"280","8.256732","204.79.197.200","100.86.104.173","TCP","1514","443  >  51913 [ACK] Seq=147144 Ack=6497 Win=16380 Len=1460 [TCP segment of a reassembled PDU]"
"281","8.256732","204.79.197.200","100.86.104.173","TCP","1514","443  >  51913 [ACK] Seq=148604 Ack=6497 Win=16380 Len=1460 [TCP segment of a reassembled PDU]"
"282","8.256732","204.79.197.200","100.86.104.173","TLSv1.2","1268","Application Data"
"283","8.256732","204.79.197.200","100.86.104.173","TCP","1514","443  >  51913 [ACK] Seq=151278 Ack=6497 Win=16380 Len=1460 [TCP segment of a reassembled PDU]"
"284","8.256732","204.79.197.200","100.86.104.173","TCP","1514","443  >  51913 [ACK] Seq=152738 Ack=6497 Win=16380 Len=1460 [TCP segment of a reassembled PDU]"
"285","8.256732","204.79.197.200","100.86.104.173","TLSv1.2","1268","Application Data"
"286","8.256732","204.79.197.200","100.86.104.173","TCP","1514","443  >  51913 [ACK] Seq=155412 Ack=6497 Win=16380 Len=1460 [TCP segment of a reassembled PDU]"
"287","8.256732","204.79.197.200","100.86.104.173","TCP","1514","443  >  51913 [ACK] Seq=156872 Ack=6497 Win=16380 Len=1460 [TCP segment of a reassembled PDU]"
"288","8.256732","204.79.197.200","100.86.104.173","TLSv1.2","1268","Application Data"
"289","8.256732","204.79.197.200","100.86.104.173","TCP","1514","443  >  51913 [ACK] Seq=159546 Ack=6497 Win=16380 Len=1460 [TCP segment of a reassembled PDU]"
"290","8.256732","204.79.197.200","100.86.104.173","TCP","1514","443  >  51913 [ACK] Seq=161006 Ack=6497 Win=16380 Len=1460 [TCP segment of a reassembled PDU]"
"291","8.256732","204.79.197.200","100.86.104.173","TLSv1.2","1268","Application Data"
"292","8.256732","204.79.197.200","100.86.104.173","TCP","1514","443  >  51913 [ACK] Seq=163680 Ack=6497 Win=16380 Len=1460 [TCP segment of a reassembled PDU]"
"293","8.256732","204.79.197.200","100.86.104.173","TCP","1514","443  >  51913 [ACK] Seq=165140 Ack=6497 Win=16380 Len=1460 [TCP segment of a reassembled PDU]"
"294","8.256732","204.79.197.200","100.86.104.173","TLSv1.2","645","Application Data"
"295","8.256732","204.79.197.200","100.86.104.173","TCP","1514","[TCP Retransmission] 443  >  51913 [PSH, ACK] Seq=165731 Ack=6497 Win=16380 Len=1460 [TCP segment of a reassembled PDU]"
"296","8.256732","204.79.197.200","100.86.104.173","TCP","1514","[TCP Out-Of-Order] 443  >  51913 [ACK] Seq=134742 Ack=6497 Win=16380 Len=1460"
"297","8.257142","100.86.104.173","204.79.197.200","TCP","66","[TCP Dup ACK 272#1] 51913  >  443 [ACK] Seq=6497 Ack=134742 Win=2087 Len=0 SLE=137662 SRE=138876"
"298","8.257251","100.86.104.173","204.79.197.200","TCP","66","[TCP Dup ACK 272#2] 51913  >  443 [ACK] Seq=6497 Ack=134742 Win=2087 Len=0 SLE=137662 SRE=140336"
"299","8.257287","100.86.104.173","204.79.197.200","TCP","66","[TCP Dup ACK 272#3] 51913  >  443 [ACK] Seq=6497 Ack=134742 Win=2087 Len=0 SLE=137662 SRE=141796"
"300","8.257316","100.86.104.173","204.79.197.200","TCP","66","[TCP Dup ACK 272#4] 51913  >  443 [ACK] Seq=6497 Ack=134742 Win=2087 Len=0 SLE=137662 SRE=143010"
"301","8.257337","100.86.104.173","204.79.197.200","TCP","66","[TCP Dup ACK 272#5] 51913  >  443 [ACK] Seq=6497 Ack=134742 Win=2087 Len=0 SLE=137662 SRE=144470"
"302","8.257357","100.86.104.173","204.79.197.200","TCP","66","[TCP Dup ACK 272#6] 51913  >  443 [ACK] Seq=6497 Ack=134742 Win=2087 Len=0 SLE=137662 SRE=145930"
"303","8.257376","100.86.104.173","204.79.197.200","TCP","66","[TCP Dup ACK 272#7] 51913  >  443 [ACK] Seq=6497 Ack=134742 Win=2087 Len=0 SLE=137662 SRE=147144"
"304","8.257398","100.86.104.173","204.79.197.200","TCP","66","[TCP Dup ACK 272#8] 51913  >  443 [ACK] Seq=6497 Ack=134742 Win=2087 Len=0 SLE=137662 SRE=148604"
"305","8.257436","100.86.104.173","204.79.197.200","TCP","66","[TCP Dup ACK 272#9] 51913  >  443 [ACK] Seq=6497 Ack=134742 Win=2087 Len=0 SLE=137662 SRE=150064"
"306","8.257460","100.86.104.173","204.79.197.200","TCP","66","[TCP Dup ACK 272#10] 51913  >  443 [ACK] Seq=6497 Ack=134742 Win=2087 Len=0 SLE=137662 SRE=151278"
"307","8.257482","100.86.104.173","204.79.197.200","TCP","66","[TCP Dup ACK 272#11] 51913  >  443 [ACK] Seq=6497 Ack=134742 Win=2087 Len=0 SLE=137662 SRE=152738"
"308","8.257509","100.86.104.173","204.79.197.200","TCP","66","[TCP Dup ACK 272#12] 51913  >  443 [ACK] Seq=6497 Ack=134742 Win=2087 Len=0 SLE=137662 SRE=154198"
"309","8.257533","100.86.104.173","204.79.197.200","TCP","66","[TCP Dup ACK 272#13] 51913  >  443 [ACK] Seq=6497 Ack=134742 Win=2087 Len=0 SLE=137662 SRE=155412"
"310","8.257556","100.86.104.173","204.79.197.200","TCP","66","[TCP Dup ACK 272#14] 51913  >  443 [ACK] Seq=6497 Ack=134742 Win=2087 Len=0 SLE=137662 SRE=156872"
"311","8.257590","100.86.104.173","204.79.197.200","TCP","66","[TCP Dup ACK 272#15] 51913  >  443 [ACK] Seq=6497 Ack=134742 Win=2087 Len=0 SLE=137662 SRE=158332"
"312","8.257610","100.86.104.173","204.79.197.200","TCP","66","[TCP Dup ACK 272#16] 51913  >  443 [ACK] Seq=6497 Ack=134742 Win=2087 Len=0 SLE=137662 SRE=159546"
"313","8.257628","100.86.104.173","204.79.197.200","TCP","66","[TCP Dup ACK 272#17] 51913  >  443 [ACK] Seq=6497 Ack=134742 Win=2087 Len=0 SLE=137662 SRE=161006"
"314","8.257646","100.86.104.173","204.79.197.200","TCP","66","[TCP Dup ACK 272#18] 51913  >  443 [ACK] Seq=6497 Ack=134742 Win=2087 Len=0 SLE=137662 SRE=162466"
